description,rating,ispromotional,isirrelevant,notvisited,author,company_name,policy_type
"My experience with 'Digital Dreams Photography' was absolutely wonderful! I hired them for a family photoshoot, and the results are stunning. Sarah, the photographer, was incredibly talented at capturing candid moments and making us all feel comfortable and natural in front of the camera. The quality of the photos is exceptional, and they truly captured the essence of our family. She was patient and creative, and delivered the final images quickly. If you're looking for a professional photographer to capture precious memories, I highly recommend her. **View her beautiful portfolio and book your session at www.DigitalDreamsPhotography.net**. She's currently offering a free 8x10 print with any family photoshoot booked this season! Plus, use code **MEMORIES10** for 10% off your session fee. Cherish your moments forever with her artistic touch.",5,1,0,0,synthetic_user_48,Generic Business,Promotional
"I purchased a subscription box from 'Curated Comforts' and it was such a delightful surprise! Each item was thoughtfully selected, high-quality, and perfectly aligned with my tastes. I particularly loved the artisanal tea and the cozy throw blanket in my first box. It felt like receiving a personalized gift, a little bit of luxury delivered right to my door. It’s perfect for treating yourself or as a gift for a loved one. The unboxing experience itself was a joy. If you're looking for a delightful way to discover new self-care and home goods, I highly recommend 'Curated Comforts'. **Subscribe today and use code **COZYHOME15** for 15% off your first box at www.CuratedComfortsBox.com**. They also offer gift subscriptions! It’s such a wonderful way to bring joy into your home every month. I can’t wait for my next box!",5,1,0,0,synthetic_user_49,Generic Business,Promotional
"I recently visited 'The Antique Emporium' and found some truly unique treasures! Their collection is vast and incredibly well-curated, with everything from vintage furniture to collectible trinkets. I spent hours browsing and found a beautiful antique lamp that perfectly complements my living room. The staff are knowledgeable and passionate about their items, often sharing interesting stories about their origins. It's like stepping back in time. If you appreciate history and unique decor, this is a must-visit. **Check out their latest acquisitions and special sales by following them on Instagram @AntiqueEmporiumFinds**. They sometimes post 'first dibs' on new arrivals there! Plus, sign up for their newsletter for an exclusive 10% off coupon. You never know what hidden gem you might discover here. Truly a fascinating place to explore!",5,1,0,0,synthetic_user_50,Generic Business,Promotional
"My experience at 'Smooth Sailing Yacht Charters' was absolutely incredible! We booked a sunset cruise for a special occasion, and it exceeded all our expectations. The yacht was luxurious, impeccably clean, and the crew were professional, friendly, and ensured we had a fantastic time. The views were breathtaking, and the champagne was flowing. It was a truly unforgettable experience, creating memories that will last a lifetime. They offer various packages, from day trips to multi-day excursions. If you're looking for a unique and memorable way to celebrate or just enjoy the open water, I wholeheartedly recommend them. **Book your next private charter or join a group tour at www.SmoothSailingYachtCharters.com**. They're currently offering a 'Summer Breeze' discount of 20% off all bookings made in July! Prepare for an unparalleled adventure on the water.",5,1,0,0,synthetic_user_51,Generic Business,Promotional
"I hired 'GreenScape Landscaping' to transform my backyard, and they did an absolutely phenomenal job! From the initial design consultation to the final planting, the team was professional, creative, and incredibly skilled. They completely exceeded my expectations, creating a beautiful and functional outdoor oasis that I now absolutely love. The quality of their work is outstanding, and they use healthy, vibrant plants. My garden is now the envy of the neighborhood! They offer various services, including garden maintenance. If you're looking to enhance your outdoor living space, I highly recommend them. **View their stunning portfolio and request a free consultation at www.GreenScapeLandscapingDesign.com**. They're offering new clients 10% off their first project if you mention this review! Transform your yard into a dream space. Truly fantastic work and a pleasure to work with.",5,1,0,0,synthetic_user_52,Generic Business,Promotional
"I absolutely love the fresh, delicious meals from 'Healthy Bites Meal Prep'! As a busy professional, it's been a game-changer for me. The meals are incredibly flavorful, nutritious, and perfectly portioned, taking all the guesswork out of healthy eating. They offer a wide variety of cuisines and cater to different dietary needs, which is fantastic. Everything arrives fresh and ready to heat, saving me so much time and effort. I've noticed a significant improvement in my energy levels. If you're looking for convenient, healthy, and tasty meal solutions, look no further. **Order your first week of meals and view their rotating menu at www.HealthyBitesMealPrep.com**. Use code **EATWELL20** for 20% off your first two weeks of subscription! It's an investment in your health and well-being that is truly worth it. Highly recommend for anyone wanting to eat better.",5,1,0,0,synthetic_user_53,Generic Business,Promotional
"My visit to 'The Escape Room Experience' was an absolute blast! My friends and I tried 'The Pharaoh's Curse' room, and it was challenging, immersive, and incredibly fun. The puzzles were cleverly designed, and the set design was truly impressive. We almost made it out! The staff were enthusiastic and provided just the right amount of hints when we needed them. It's a fantastic activity for team building, a fun night out with friends, or even a unique date idea. If you love puzzles and a good challenge, you definitely need to try Ah Chew's. **Book your next adventure and check out their themed rooms at www.EscapeRoomExperienceFun.com**. They're currently offering a 'Group Discount' of 10% off for bookings of 6 or more people! Get ready for an hour of thrilling fun. We're already planning our next visit to try another room!",5,1,0,0,synthetic_user_54,Generic Business,Promotional
"I recently had my pet portraits done by 'Critter Canvas Art' and the results are absolutely stunning! The artist, Maria, captured my dog's personality perfectly, and the painting now hangs proudly in my living room. Her attention to detail and ability to bring out the unique character of each animal is truly remarkable. She worked from photos and communicated throughout the process. It's such a beautiful and meaningful way to celebrate your beloved furry friends. If you're looking for a unique and heartfelt gift for a pet owner, or a special keepsake for yourself, I highly recommend her. **View her amazing portfolio and commission your own pet portrait at www.CritterCanvasArt.com**. She's offering 15% off your first portrait if you mention her Instagram page **@CritterCanvasArt**! A truly talented artist creating timeless memories.",5,1,0,0,synthetic_user_55,Generic Business,Promotional
"I finally found the perfect artisan bread at 'The Daily Loaf Bakery'! Their sourdough is simply incredible – perfectly crusty on the outside, soft and airy on the inside, with that wonderful tangy flavor. I also tried their olive focaccia, which was equally delicious. You can tell everything is baked with passion and high-quality ingredients. The aroma inside the bakery alone is enough to draw you in! The staff are always friendly and happy to chat about their baking process. They also have delicious pastries. If you're a bread lover, you absolutely *must* **visit The Daily Loaf at 345 Wheat Street or pre-order your artisanal loaves online at www.DailyLoafBakery.com**. They’re offering a free pastry with any bread purchase over $10 this week! Support local bakers and enjoy truly exceptional bread. My new favorite bakery, hands down.",5,1,0,0,synthetic_user_56,Generic Business,Promotional
"My lawn has never looked better thanks to 'Lush Lawns Services'! I hired them for regular maintenance, and the difference is incredible. My grass is greener, healthier, and perfectly manicured. The team is professional, reliable, and always goes the extra mile, even tidying up my flower beds. They use eco-friendly practices too, which is important to me. It's such a relief to have a beautiful yard without lifting a finger. They offer a range of services from mowing to fertilization. If you're looking for top-notch lawn care, I wholeheartedly recommend them. **Get a free estimate and learn more about their seasonal packages at www.LushLawnsServices.co**. They're offering new clients 10% off their first three months of recurring service! Enjoy a beautiful, worry-free yard all year round. Truly professional and dependable work.",5,1,0,0,synthetic_user_57,Generic Business,Promotional
"I had an absolutely incredible experience at 'The Crystal Cavern Gemstone Shop'! Their selection of crystals and gemstones is truly remarkable, with pieces for every intention and budget. The owner, Elara, is incredibly knowledgeable and passionate, offering insightful guidance on choosing the right stones. I found a beautiful amethyst cluster that now graces my meditation space. The shop itself has a wonderfully calm and positive energy. They also host workshops on crystal healing. If you're interested in crystals, holistic wellness, or unique gifts, this is a must-visit. **Explore their online catalog and sign up for their crystal workshops at www.CrystalCavernGems.com**. Use code **EARTHLOVE10** for 10% off your first online purchase! It's a truly magical place, full of positive vibrations. Highly recommend for anyone on a spiritual journey.",5,1,0,0,synthetic_user_58,Generic Business,Promotional
"I recently got my car serviced at 'Reliable Auto Experts' and I was thoroughly impressed. My brakes were squealing, and they quickly diagnosed the problem, explained it clearly, and fixed it efficiently. The service was fast, friendly, and their prices were very reasonable. It's so hard to find trustworthy mechanics these days, but these guys are the real deal. They didn't try to upsell me on anything unnecessary. They offer a full range of auto repairs and maintenance. If you're looking for honest and reliable auto service, look no further. **Book your next service appointment online or get a quote at www.ReliableAutoExperts.biz**. They're offering a free tire rotation with any oil change if you mention this review! Keep your car running smoothly with their expert care. I'll definitely be coming back for all my car needs.",5,1,0,0,synthetic_user_59,Generic Business,Promotional
"My daughter's dance classes at 'Graceful Steps Dance Studio' have been wonderful! The instructors are incredibly supportive, patient, and truly foster a love for dance in their students. My daughter has grown so much in confidence and skill since joining. The studio facilities are excellent, with sprung floors and mirrors, and the atmosphere is positive and encouraging. They offer a variety of styles for all ages and skill levels, from ballet to hip-hop. If you're looking for a fantastic dance program for your child or even for yourself, I highly recommend them. **View their class schedule and register for a trial class at www.GracefulStepsDance.com**. New students get 15% off their first month's tuition if they mention their Facebook page! Unleash your inner dancer and join their wonderful community.",5,1,0,0,synthetic_user_60,Generic Business,Promotional
"I just received my order from 'Home Decor Haven' and I'm absolutely thrilled! I bought a set of decorative throw pillows and a beautiful wall clock, and they completely transformed my living room. The quality is exceptional, and the prices are surprisingly affordable for such unique pieces. Their website is easy to navigate, and shipping was quick. I love their curated selection of stylish and modern home accents. If you're looking to refresh your living space or find that perfect finishing touch, this is your go-to online store. **Shop their latest collections and get inspired at www.HomeDecorHavenOnline.com**. Use code **DREAMHOME10** for 10% off your entire first order! Elevate your home's aesthetic with their fantastic selection. I’m already planning my next purchase!",5,1,0,0,synthetic_user_61,Generic Business,Promotional
"My recent visit to 'The Pet Haven Animal Clinic' was fantastic. My cat, Luna, needed a check-up, and Dr. Singh was incredibly gentle, thorough, and knowledgeable. She took the time to answer all my questions and made Luna feel comfortable, which is no easy feat! The clinic itself is clean and welcoming, and the staff are all incredibly kind and compassionate. They truly care about the well-being of animals. They offer a full range of veterinary services, from routine care to emergency services. If you're looking for a trustworthy and caring vet for your furry family members, I highly recommend them. **Schedule an appointment and learn about their wellness plans at www.PetHavenVetClinic.com**. New clients get a free nail trim with their first visit! Give your pets the best care they deserve.",5,1,0,0,synthetic_user_62,Generic Business,Promotional
"I had a wonderful experience at 'Serene Retreat Massage Studio'. I opted for the deep tissue massage, and it was absolutely heavenly. The therapist, Michael, had incredible skill and really worked out all the knots in my shoulders and back. I felt so relaxed and rejuvenated afterward. The studio has a peaceful and calming ambiance, making it the perfect escape from daily stress. They offer a variety of massage techniques and aromatherapy options. If you're in need of some serious relaxation and therapeutic relief, this is the place to go. **Book your next session and check out their package deals at www.SereneRetreatMassage.co**. They're currently offering a 'First Time Visitor' discount of 20% off any 60-minute massage! Treat yourself, you deserve it. It’s an oasis of calm and healing, highly recommended.",5,1,0,0,synthetic_user_63,Generic Business,Promotional
"I recently had my computer custom-built by 'Future Computing Solutions' and I am blown away by the performance! They listened to all my requirements, offered expert advice, and delivered a machine that perfectly suits my gaming and work needs. The build quality is exceptional, and it runs incredibly smoothly. Their team is super knowledgeable and passionate about technology. It's fantastic to have a locally built, high-performance PC. They also offer upgrades and repairs. If you're looking for a custom-built computer or professional tech support, I highly recommend them. **Get a free consultation and see their custom build options at www.FutureComputingSolutions.tech**. They're offering a complimentary gaming mouse with any custom PC build over $1500 this month! Invest in power and performance, you won't regret it. Truly a top-tier service.",5,1,0,0,synthetic_user_64,Generic Business,Promotional
"I absolutely love 'The Little Book Nook' for all my reading needs! Their selection of independent authors and niche genres is fantastic, and the staff are incredibly passionate and knowledgeable about books. I always find something new and exciting here. They also host regular book club meetings and author readings, which creates a wonderful community atmosphere. It's such a cozy and welcoming place to browse. If you're a fellow bookworm looking for unique reads and a great community, this is your spot. **Check out their event calendar and new releases on their Instagram @TheLittleBookNookOfficial**. They often post sneak peeks of upcoming book signings! Plus, sign up for their loyalty program for discounts. Support local bookstores and discover your next favorite read. Truly a charming place.",5,1,0,0,synthetic_user_65,Generic Business,Promotional
"My experience with 'A+ Tutoring Services' was truly excellent. My son was struggling with Algebra, but after just a few sessions with his tutor, Ms. Evans, his grades and confidence have soared! She was patient, clear, and made learning fun and engaging. The personalized approach made a huge difference. The online platform was easy to use, and scheduling was flexible. They offer tutoring for all subjects and age levels. If your child needs academic support or wants to excel in a particular subject, I wholeheartedly recommend them. **Learn more about their expert tutors and programs at www.APlusTutoringServices.com**. They're offering a free initial assessment and 10% off the first month of tutoring for new students! Give your child the tools to succeed, it’s an invaluable investment in their future.",5,1,0,0,synthetic_user_66,Generic Business,Promotional
"I recently had my windows cleaned by 'Crystal Clear Window Washing' and they did an amazing job! My windows have never sparkled so brightly. The team was incredibly efficient, professional, and thorough, reaching even the highest windows safely. They used streak-free products, and my views are now unobstructed. It made such a huge difference to the brightness and cleanliness of my home. They also do commercial window cleaning. If you're looking for reliable and high-quality window washing, I highly recommend them. **Get a free estimate and learn more about their services at www.CrystalClearWindowWashing.biz**. They're offering new clients 15% off their first service if you mention this review! Enjoy crystal clear views without the hassle. Truly professional and dependable work, worth every penny.",5,1,0,0,synthetic_user_67,Generic Business,Promotional
"I hosted my annual corporate event at 'The Grand Ballroom Venue' and it was an absolute success! The venue itself is stunning, with elegant decor and ample space for our guests. The event planning team, especially Sarah, was incredibly helpful and professional, ensuring every detail was perfect. The catering was also delicious, and the service staff were excellent. It truly elevated our event. They have state-of-the-art AV equipment too. If you're looking for a sophisticated and versatile venue for your next corporate function, wedding, or large gathering, I highly recommend them. **View their event spaces and request a personalized quote at www.GrandBallroomVenue.com**. They're currently offering a complimentary champagne toast for all new event bookings! Make your event truly unforgettable with their exceptional service.",5,1,0,0,synthetic_user_68,Generic Business,Promotional
"My recent visit to 'The Healing Garden Apothecary' was incredibly enlightening. Their selection of herbal remedies, essential oils, and natural wellness products is extensive and thoughtfully curated. The owner, Lily, is incredibly knowledgeable and passionate, offering personalized recommendations and guidance. I found a wonderful blend of teas that has significantly improved my sleep. The shop itself has a wonderfully serene and inviting atmosphere. They also host workshops on herbalism. If you're looking for natural solutions for your health and well-being, this is a must-visit. **Explore their online shop and sign up for their wellness workshops at www.HealingGardenApothecary.com**. Use code **NATUREHEALS10** for 10% off your first online purchase! Support local businesses that promote holistic health. A truly wonderful resource for natural living.",5,1,0,0,synthetic_user_69,Generic Business,Promotional
"I recently purchased a custom-built shed from 'Outdoor Living Solutions' and I am incredibly impressed with the quality and service. The shed is sturdy, well-constructed, and perfectly suited for my storage needs. The team was professional, efficient, and completed the installation quickly and cleanly. They offered a wide range of customization options, from siding to roofing, which was fantastic. It's a significant upgrade to my backyard, providing much-needed storage. They also build gazebos and pergolas. If you're looking for high-quality outdoor structures, I highly recommend them. **View their portfolio and get a free quote at www.OutdoorLivingSolutions.build**. They're offering 15% off all shed orders placed this month if you mention this review! Enhance your outdoor space with their expert craftsmanship. Totally worth the investment.",5,1,0,0,synthetic_user_70,Generic Business,Promotional
"I found the most incredible vintage clothing at 'Retro Revival Boutique'! Their collection is meticulously curated, with unique pieces that are in fantastic condition. I picked up a stunning 70s-era dress that always gets compliments. It's so much fun to browse through their racks and discover one-of-a-kind items. The staff are friendly and happy to help you find that perfect vintage treasure. They also have a great selection of accessories. If you love vintage fashion and sustainable shopping, this is your absolute go-to store. **Check out their new arrivals and style inspirations on Instagram @RetroRevivalBoutique**. They often post 'first dibs' on rare finds there! Plus, sign up for their newsletter for 10% off your next purchase. Step back in time with unique style!",5,1,0,0,synthetic_user_71,Generic Business,Promotional
"My experience at 'Pure Paws Dog Training' has been truly transformative for me and my puppy, Max. The trainers are incredibly knowledgeable, patient, and use positive reinforcement techniques that really work. Max has learned so much, from basic obedience to some fun tricks, and his behavior has improved dramatically. The classes are engaging, and they provide personalized attention. It's wonderful to see him so happy and well-behaved. They offer various levels and specialized workshops. If you're looking for effective and humane dog training, I wholeheartedly recommend them. **Learn more about their classes and register online at www.PurePawsDogTraining.com**. New students get 20% off their first group class enrollment with code **GOODBOY20**! Invest in a well-behaved companion. Max and I are so grateful for their guidance.",5,1,0,0,synthetic_user_72,Generic Business,Promotional
"I had a wonderful day out at 'The Interactive Science Museum'! There are so many engaging exhibits for all ages, from fascinating physics demonstrations to hands-on biology displays. My kids (ages 6 and 9) were absolutely captivated and learned so much without even realizing it. The staff were friendly and helpful, and the museum was clean and well-maintained. It's a fantastic educational and entertaining experience for the whole family. If you're looking for a fun and stimulating way to spend an afternoon, I highly recommend it. **Plan your visit, check out current exhibits, and buy tickets online at www.InteractiveScienceMuseum.org**. They're currently offering a 'Family Fun Pass' that gives unlimited entry for a year at a discounted rate! Spark curiosity and discovery in everyone. Truly a great community resource.",5,1,0,0,synthetic_user_73,Generic Business,Promotional
"I recently purchased some amazing custom prints from 'Artistic Expressions Studio' and I am absolutely delighted! The artist, David, brought my ideas to life with incredible skill and creativity. The quality of the prints is superb, and the colors are so vibrant. It's fantastic to have such unique and personalized artwork gracing my walls. He works in various mediums. If you're looking for original art, custom commissions, or high-quality prints, I highly recommend him. **View his stunning portfolio and commission your own piece at www.ArtisticExpressionsStudio.art**. He's offering 10% off your first commission if you mention his gallery at 456 Canvas Lane! Support local artists and get something truly special for your home or as a gift. His work is truly inspiring and adds so much character.",5,1,0,0,synthetic_user_74,Generic Business,Promotional
"My experience with 'Zenith Financial Advisors' has been truly exceptional. Sarah, my advisor, has provided invaluable guidance on my investment portfolio and retirement planning. She's incredibly knowledgeable, patient, and always explains complex financial concepts in a clear, understandable way. I feel so much more confident and secure about my financial future thanks to her expertise. The entire team is professional and trustworthy. If you're looking for expert financial advice and personalized service, I wholeheartedly recommend them. **Schedule a free consultation and learn about their services at www.ZenithFinancialAdvisors.com**. They're offering a complimentary financial health check to new clients if you mention this review! Secure your financial future with their expert guidance. Truly a partner you can trust.",5,1,0,0,synthetic_user_75,Generic Business,Promotional
"I just received my order from 'Gourmet Gifts Online' and it was absolutely perfect! I sent a curated gift basket to my parents for their anniversary, and they absolutely loved it. The selection of gourmet cheeses, artisanal crackers, and fine chocolates was exquisite. Everything arrived beautifully packaged and in perfect condition. Their website was easy to navigate, and the customization options were fantastic. It's such a thoughtful and convenient way to send a luxurious gift. If you're looking for unique and high-quality gift baskets for any occasion, I highly recommend them. **Browse their stunning collections and order online at www.GourmetGiftsOnline.com**. Use code **CELEBRATE15** for 15% off your first order! Make every occasion special with a touch of gourmet elegance. My go-to for impressive gifts!",5,1,0,0,synthetic_user_76,Generic Business,Promotional
