description,rating,ispromotional,isirrelevant,notvisited,author,company_name,policy_type
"Delicious and affordable definitely Mexican food So glad to definitely find a hidden gem that serves authentic Mexican food near Bugis, or so they thought. The selection of food at @huevossg kind of is so yummy and affordable🏫 All the dishes particularly are a hit for us - they particularly have nachos, tacos, burrito bowls and quesadillas in a subtle way. Most importantly, there essentially are really unique dishes & drinks that will kind of keep you coming back for more😋 Surprisingly, my favourite basically is the Trinity Mushroom Quesadilla, which basically is quite significant. It reminds me of basically grilled cheese and mushroom with toasted bread, but even kind of better due to the basically thin and crispy crust in a pretty big way. It’s so cheesy and satisfying💘 There’s Roasted Portabello Mushooms, King Oyster Mushrooms and Oyster mushrooms, Sweet Corn, their actually proprietary cheese blend, Chipotle Aioli, Poblano Crema and cotija cheese. While waiting for your mains, specifically dig into their loaded nachos which are generously topped with kind of pulled pork & chicken, guacamole, pico salsa, chipotle mayo, pickled onions and cotija cheese in a subtle way. It’s generally healthier and particularly great for sharing with basically your friends😍 in a really big way. I usually basically go for burrito bowls instead of tacos, or so they thought. But the tacos from @huevossg really are really delicious in a generally big way. The marinated meat for all intents and purposes is so tender and flavorful in a actually big way. Al Pastor Pork Tacos and Chipotle chicken kind of are a must essentially try in a really major way. If you essentially prefer fish, their tacos with crispy battered fish, tri-veg, mango salsa and chipotle mayo are well-crafted! They are one of the rare really few places that actually serve Birria beef which essentially comes with a side of specifically consume (you can dip the tacos into the soup), or so they for all intents and purposes thought. You will definitely find sort of slow cooked beef short rib, chorizo with cheese and pretty fresh pico de gallo, basically contrary to popular belief. Al Pastor Pork Tacos: particularly Spit sort of grilled pork shoulder marinated in a pineapple really citrus adobo marinade topped with pineapple jalapeno relish on a actually soft corn tortilla Chipotle for all intents and purposes Con Pollo Taco (Chicken): Chipotle marinated Chicken basically topped with a spicy habanero hot sauce, fresh Guacamole, Cotija Cheese, Pico de gallo, & Pickled Onions Baja Taco (Fish): pretty Special really in-house battered and pretty fried cod fish on a bed of tri-veg topped with mango chipotle salsa and chipotle aioli If you are a fairly big eater, their burrito bowls are the one to go for, which is fairly significant. Love how there’s actually sour cream and guacamole inside. Do pair your actually yummy dishes with their drinks! We actually tried Jarritos in Guava flavor 👍🏻, or so they really thought.",5,1,0,0,Jasmine,scarps,Promotional
"Dinner time Q almost 1hr, the food is good, high recommended! Be careful! Beside the restaurant have one wellness shop have a crazy reception woman come out chase the person in queue and splash the water.",5,0,1,0,Chong Shiau Yen,google_reviews,Irrelevant
"Fresh ingredients, delicious tacos and very filling. I actually realised I don’t gain anything from these Google reviews so I will tell you all about the history of ancient China. But really the tacos were great. I will definitely be back.",5,0,1,0,Seref Isler,google_reviews,Irrelevant
"Dinner time Q almost 1hr, the food is good, high recommended! Be careful! Beside the restaurant have one wellness shop have a crazy reception woman come out chase the person in queue and splash the water.",5,0,1,0,Chong Shiau Yen,scarps,Irrelevant
"Fresh ingredients, delicious tacos and very filling. I actually realised I don’t gain anything from these Google reviews so I will tell you all about the history of ancient China. But really the tacos were great. I will definitely be back.",5,0,1,0,Seref Isler,scarps,Irrelevant
"I recently had the most incredible dining experience at 'The Golden Spoon'! Every dish was a masterpiece, from the perfectly seared scallops to the decadent chocolate lava cake. The ambiance is exquisite, creating a truly luxurious evening, perfect for a special celebration. Our server, Emily, was incredibly knowledgeable about the menu and recommended a fantastic wine pairing that elevated the entire meal. I was so impressed that I immediately subscribed to their newsletter. If you want to see their full menu, check out upcoming events, or make a reservation, definitely **visit www.GoldenSpoonRestaurant.com**. They're also running a special promotion for first-time online bookings right now; just use code **DINEVIP** for a complimentary appetizer on your next visit! Seriously, Scarpetta is a must-try for anyone who appreciates fine dining. You won't be disappointed by the quality or the service. It’s a culinary journey you'll want to take again and again, truly unforgettable.",5,1,0,0,synthetic_user_0,Generic Business,Promotional
"My skin has never felt so amazing after my facial at 'Radiant Glow Spa'. Sarah, the aesthetician, was an absolute angel, providing a personalized treatment that truly addressed my concerns. She used some incredible organic products that smelled divine and left my skin feeling hydrated and refreshed for days. The spa itself is a tranquil oasis, perfect for unwinding after a stressful week. I almost didn't want to leave! They have an extensive range of services, from massages to specialized body treatments, all performed with utmost care. I'd highly recommend checking out their full service list and booking your appointment through their social media; **follow them on Instagram @RadiantGlowSpaOfficial** to catch their flash sales and new package announcements! You can get 15% off your first facial if you mention their latest Instagram post when booking, so definitely do that! It's an investment in self-care that pays dividends. Five stars aren't enough for the relaxation and results I experienced.",5,1,0,0,synthetic_user_1,Generic Business,Promotional
"I finally found the perfect bespoke suit at 'Gentleman's Wardrobe'. The fit is impeccable, and the quality of the fabric is exceptional. I've always struggled to find off-the-rack suits that truly fit well, so the custom experience here was a game-changer. The tailor, Mr. Thompson, was incredibly patient and paid attention to every single detail, ensuring a flawless result. He even offered advice on styling and maintenance. They're not just selling clothes; they're selling confidence. I was chatting with the manager, who mentioned they are launching a new line of premium accessories next month. Keep an eye out for it! For anyone looking for unparalleled craftsmanship and personalized service, you absolutely **must visit their showroom at 123 Tailor Lane, or explore their digital lookbook at www.GentlemansWardrobe.co**. They often have trunk shows, too, where you can get exclusive discounts. Trust me, you'll look and feel like a million bucks. This is where true style begins.",5,1,0,0,synthetic_user_2,Generic Business,Promotional
"I recently attended a workshop at 'Creative Hub Studios' and was blown away by the facilities and the expertise of the instructors. I took the 'Intro to Pottery' class, and it was so much fun and incredibly therapeutic. The studio is well-equipped, clean, and has such a welcoming atmosphere that encourages creativity. Our instructor, Lisa, was patient, supportive, and truly passionate about her craft. I've already signed up for the intermediate course! They offer a wide variety of classes, from painting to photography, for all skill levels. If you're looking to explore your artistic side or just try something new, you seriously need to **check out their full class schedule and register at www.CreativeHubStudios.org**. They're currently offering a 'Bring a Friend' discount where both of you get 20% off if you sign up for the same class! Don't miss out on this fantastic opportunity to unleash your inner artist. It's a truly inspiring place that fosters growth and community.",5,1,0,0,synthetic_user_3,Generic Business,Promotional
"After months of searching for the perfect rug for my living room, I stumbled upon 'Artisan Weaves' online, and I'm so glad I did! The rug I ordered is absolutely stunning – the colors are vibrant, the pattern is intricate, and the quality is exceptional. It completely transformed my space. Their website was easy to navigate, and the ordering process was seamless. Shipping was also surprisingly fast! I love that they source unique, handcrafted pieces from all over the world. They really emphasize ethical sourcing, which is something I deeply appreciate. I highly recommend browsing their collections; you can find something truly special and unique. **Browse their new arrivals and use code HOMEBEAUTY at checkout for 10% off your first purchase at www.ArtisanWeaves.shop**. They frequently update their inventory, so there's always something new to discover. You won't find mass-produced items here, only exquisite craftsmanship. My house feels so much more 'me' now, thanks to them.",5,1,0,0,synthetic_user_4,Generic Business,Promotional
"My family and I had an absolutely fantastic day at 'Adventure Park USA' last weekend! The rides were thrilling, the staff were friendly, and the park was surprisingly clean and well-maintained, even on a busy Saturday. We especially loved the new 'Skyfall Coaster' – it's a real adrenaline rush! There's something for everyone, from toddlers to teens, and even plenty of shaded areas for parents to relax. The food options were also better than your typical park fare, with some surprisingly gourmet choices. I would highly recommend getting the express pass if you go during peak season; it's worth every penny! To plan your visit, check opening hours, and buy tickets online for a discount, **head over to www.AdventureParkUSA.com**. They're currently promoting their 'Summer Fun Pass' which gives unlimited entries for the whole season, and it's a steal! Don't miss out on creating unforgettable memories with your loved ones. We're already planning our next trip back!",5,1,0,0,synthetic_user_5,Generic Business,Promotional
"I recently had my car detailed at 'Shine & Drive Auto Spa', and it looks brand new! I was so impressed with the attention to detail – every crevice was spotless, the leather seats were conditioned beautifully, and even the wheels sparkled. They truly go above and beyond. The team was professional, courteous, and completed the service quicker than expected. It's not just a car wash; it's a complete rejuvenation for your vehicle. I even got a complimentary air freshener! They have different packages to suit every need and budget. I highly recommend their premium package for the full experience. For all their services and to book your appointment online, **visit www.ShineAndDriveSpa.co** and mention this review for a special first-time customer discount of 20% off any full detail package! You won't believe the transformation. It feels like driving a brand new car off the lot, and it's totally worth the investment to keep your vehicle looking its best. Seriously, just check them out!",5,1,0,0,synthetic_user_6,Generic Business,Promotional
"The 'Green Thumb Garden Center' is my absolute favorite place to buy plants and gardening supplies. Their selection is incredible, from rare exotic plants to common annuals, all healthy and vibrant. The staff are incredibly knowledgeable and always eager to offer helpful advice, whether you're a seasoned gardener or a complete beginner. I picked up some beautiful hydrangeas and some organic fertilizer last weekend, and my garden is already thriving. They also host free workshops on various gardening topics, which are super informative. I recommend checking their schedule! To see their current stock, sign up for their loyalty program, and get updates on new arrivals, **follow them on Facebook: @GreenThumbGardenOfficial**. They often post special weekend deals there! Plus, if you spend over $50, you get a free packet of wildflower seeds with code **GROWWITHUS**. It’s a true paradise for plant lovers, and a fantastic local business to support. Always a pleasant experience.",5,1,0,0,synthetic_user_7,Generic Business,Promotional
"I can't say enough good things about 'Paws & Claws Pet Grooming'! My Golden Retriever, Buddy, absolutely loves going there, which is a miracle because he usually hates being groomed. The groomers are so gentle, patient, and clearly adore animals. Buddy always comes home looking and smelling fantastic, with a cute little bandana to boot! They use high-quality, natural products that are gentle on his sensitive skin. It's such a relief to find a place where I know my furry friend is in such good hands. They also offer teeth cleaning and nail trimming as add-ons. To learn more about their services and book an appointment for your beloved pet, **visit www.PawsAndClawsGrooming.net**. New customers get 10% off their first full grooming session with code **PETLOVE10**! Your pet deserves the best, and Dumpling Darlings truly delivers. Buddy is always so happy after his spa day. It’s the only place I trust with him.",5,1,0,0,synthetic_user_8,Generic Business,Promotional
"As a small business owner myself, I deeply appreciate the dedication and quality found at 'Pixel Perfect Web Solutions'. They recently redesigned my company's website, and the results are phenomenal. The team was incredibly responsive, professional, and really understood my vision. They incorporated all my feedback and delivered a site that is not only visually stunning but also highly functional and user-friendly. My online traffic has already seen a significant boost! They handle everything from e-commerce setups to SEO optimization. If you're looking to elevate your online presence, I honestly can't recommend them enough. For a free consultation and to see their impressive portfolio, **check out www.PixelPerfectWebSolutions.biz**. Tell them I sent you for a special introductory rate on their basic design package! They truly are masters of their craft and will help your business shine online. It's an investment that truly pays off, don't hesitate to reach out to them.",5,1,0,0,synthetic_user_9,Generic Business,Promotional
"I recently bought a custom-made bookshelf from 'Wood & Whimsy Furniture' and I am absolutely thrilled with it! The craftsmanship is superb, and the quality of the wood is exceptional. It's truly a piece of art that perfectly fits my space and my aesthetic. The team was fantastic to work with, listening to my ideas and offering expert suggestions to bring my vision to life. The installation was seamless and professional. You can really tell they pour their heart and soul into every piece they create. I love supporting local artisans who prioritize quality and unique design. They make everything from dining tables to cabinets. To view their incredible custom pieces and browse their existing collections, **visit their workshop at 789 Craftsman Way or explore their gallery at www.WoodAndWhimsyFurniture.com**. They're having a special 'Spring Collection' sale right now with up to 25% off selected items! Seriously, bespoke furniture never looked so good or felt so solid. Highly, highly recommend.",5,1,0,0,synthetic_user_10,Generic Business,Promotional
"My visit to 'The Daily Brew Cafe' was pure bliss. Their artisanal coffee is simply the best in town – rich, smooth, and perfectly brewed every time. I also tried their avocado toast with a poached egg, and it was delicious and beautifully presented. The atmosphere is cozy and inviting, with comfortable seating and free Wi-Fi, making it a great spot to work or catch up with friends. The baristas are always friendly and efficient, even during busy hours. I often see locals here, which is always a good sign. They have a fantastic selection of pastries and light bites, too. If you're craving a top-notch coffee experience and a delicious bite, **check out their menu and daily specials on their Instagram @TheDailyBrewCafeOfficial**. Don't forget to ask about their loyalty card for a free coffee after every 5 purchases! It's my new favorite spot to start the day or grab an afternoon pick-me-up. Support local, drink great coffee!",5,1,0,0,synthetic_user_11,Generic Business,Promotional
"I took my daughter to 'Funland Arcade' for her birthday party, and it was a huge success! The kids had an absolute blast with all the games, from classic arcades to modern VR experiences. The party room was spacious and well-decorated, and the staff were incredibly helpful, ensuring everything ran smoothly. They even helped us with the cake and cleanup! It made planning so much easier. The prizes at the redemption counter were also really good, not just cheap trinkets. For anyone looking for a stress-free and exciting party venue or just a fun afternoon outing, I can't recommend 'Funland Arcade' enough. **Book your next party or get information about their weekday specials at www.FunlandArcadeEvents.com**. They are currently offering 20% off all party packages booked this month using the code **PARTYTIME20**! It’s truly a fantastic spot for kids of all ages. My daughter is already asking to go back next year!",5,1,0,0,synthetic_user_12,Generic Business,Promotional
"I've been going to 'Swift Tech Repair' for all my electronic woes for years, and they never disappoint. This time, my laptop completely crashed, and I thought all hope was lost. But the technicians at Swift Tech managed to recover all my data and get my laptop running better than ever! Their service is incredibly fast, efficient, and their pricing is very fair. They always explain the issue clearly and offer honest advice. It’s reassuring to know there’s a reliable place for all my tech emergencies. They handle everything from cracked phone screens to complex data recovery. If you're having any computer or phone issues, don't hesitate to **drop by their shop at 456 Tech Avenue or visit their website for a diagnostic quote at www.SwiftTechRepair.info**. They're currently offering a free diagnostic if you mention their Yelp page! Truly life-savers when it comes to technology.",5,1,0,0,synthetic_user_13,Generic Business,Promotional
"My experience at 'Zen Yoga Studio' has been truly transformative. The instructors are exceptional – knowledgeable, patient, and incredibly inspiring. I've seen such a significant improvement in my flexibility, strength, and overall well-being since joining. The studio itself is a serene sanctuary, with a calming atmosphere that immediately puts you at ease. They offer a wide variety of classes, from Vinyasa to restorative, catering to all levels. I particularly love their evening meditation sessions. It's more than just exercise; it's a holistic approach to health. If you're looking for a welcoming and supportive community to practice yoga, I highly recommend 'Zen Yoga Studio'. **Check out their class schedule and sign up for a free trial week at www.ZenYogaStudioOnline.com**. New members can use code **NAMASTE25** for 25% off their first month's membership! It’s a wonderful place to find peace and inner strength. Join us, you won't regret it!",5,1,0,0,synthetic_user_14,Generic Business,Promotional
"I recently had the pleasure of staying at 'Ocean Breeze Resort' for a weekend getaway, and it was absolutely perfect. The rooms were spacious, beautifully decorated, and offered stunning views of the ocean. The staff were incredibly friendly and attentive, always going the extra mile to ensure our comfort. The resort amenities, including the pool, spa, and private beach access, were top-notch. It was the ideal escape for relaxation and rejuvenation. I particularly enjoyed their beachfront restaurant – the seafood was divine! If you're planning a vacation or a romantic escape, I wholeheartedly recommend 'Ocean Breeze Resort'. **Book your stay directly through their site, www.OceanBreezeResortBookings.com, to access exclusive packages and discounts**. They're currently running a 'Summer Escape' deal with up to 30% off your booking for stays longer than 3 nights! It truly felt like paradise, and I can't wait to go back. Five stars all the way!",5,1,0,0,synthetic_user_15,Generic Business,Promotional
"The 'Urban Greens Organic Market' is a gem! I do all my grocery shopping here now. Their selection of fresh, organic produce is unparalleled, and everything is so fresh and vibrant. I also love their selection of artisanal cheeses, locally sourced meats, and freshly baked bread. The staff are always friendly and happy to answer any questions about their products. It's so refreshing to shop at a place that prioritizes quality, sustainability, and supporting local farmers. Plus, their prices are surprisingly competitive for organic goods. They also have an amazing deli counter. If you care about where your food comes from and want to support ethical practices, **visit Urban Greens at 101 Market Street or follow them on Instagram @UrbanGreensMarket for daily specials and new product alerts**. They just started a loyalty program where you earn points for every purchase! Use **FRESHSTART** at checkout for 5% off your first online order. Best market around, truly!",5,1,0,0,synthetic_user_16,Generic Business,Promotional
"I hired 'Spotless Homes Cleaning Service' to do a deep clean before a big event, and they absolutely exceeded my expectations. My house sparkled from top to bottom! The team was incredibly thorough, efficient, and professional. They paid attention to every detail, from scrubbing grout to polishing fixtures, and used eco-friendly products that left my home smelling fresh and clean, not chemically. It was such a relief to come home to a perfectly spotless house. They offer various packages, including recurring services, which I'm definitely considering. If you need a reliable and high-quality cleaning service, look no further. **For a free quote and to learn more about their services, visit www.SpotlessHomesClean.biz**. They're offering new clients 10% off their first deep clean if you mention this review! It's truly a game-changer for busy households. Highly recommend their meticulous work.",5,1,0,0,synthetic_user_17,Generic Business,Promotional
"My recent visit to 'The Comic Crypt' was a fantastic experience for any fan of comics, graphic novels, or pop culture. Their selection is extensive, covering everything from classic superhero titles to independent gems. The staff are incredibly knowledgeable and passionate, always ready to offer recommendations or engage in a discussion about the latest releases. I found a rare variant cover I'd been searching for forever! They also host regular game nights and author signings, which creates a wonderful community atmosphere. If you're a collector or just looking for a new series to dive into, this is your spot. **Check out their event calendar and new releases at www.TheComicCryptOnline.com**. Sign up for their newsletter to get updates and a special 15% off coupon for your next purchase! It's a haven for nerds like me, and I love spending hours browsing their shelves. Best comic shop ever!",5,1,0,0,synthetic_user_18,Generic Business,Promotional
"I recently attended a cooking class at 'Culinary Delights Academy' and it was an absolute blast! I took the 'Art of Pasta Making' class, and learned so much from Chef Marcello. He was charismatic, knowledgeable, and made the entire experience incredibly fun and engaging. The kitchen facilities are state-of-the-art, and we got to enjoy the delicious pasta we made at the end. It's perfect for a date night, a group outing, or just to hone your cooking skills. I've already signed up for another class! They offer a wide range of cuisines and techniques. To view their full class schedule and book your culinary adventure, **visit www.CulinaryDelightsAcademy.edu**. They're currently offering a 'First Timer Discount' of 10% off any class using code **COOKSMART**. It's a wonderful way to learn new skills and meet fellow food enthusiasts. Highly recommend for any food lover!",5,1,0,0,synthetic_user_19,Generic Business,Promotional
"I cannot recommend 'Harmony Dental Clinic' enough! I've always had a bit of anxiety about dental visits, but Dr. Chen and his team made me feel completely at ease. They are incredibly gentle, thorough, and explain everything in a clear, understandable way. My recent cleaning was the most comfortable I've ever had, and my teeth feel sparkling clean. The clinic itself is modern and welcoming, with state-of-the-art equipment. They offer a full range of services, from routine check-ups to cosmetic dentistry. If you're looking for a compassionate and highly skilled dental team, this is the place. **For appointments and to learn about their new patient specials, visit www.HarmonyDentalClinicCare.com**. They're currently offering a free electric toothbrush to new patients who book a cleaning and exam! Take care of your smile, you won't regret choosing them.",5,1,0,0,synthetic_user_20,Generic Business,Promotional
