description,rating,ispromotional,isirrelevant,notvisited,author,company_name,policy_type
"The 'Wanderlust Travel Agency' helped me plan the most incredible trip to Italy! From flights and accommodations to guided tours and restaurant recommendations, they handled every detail flawlessly. Their expertise and insider knowledge made the entire planning process stress-free and enjoyable. I got to experience local gems that I never would have found on my own. It was truly the trip of a lifetime! Their agents are passionate about travel and genuinely care about creating personalized experiences. If you're dreaming of your next adventure but hate the hassle of planning, look no further. **Contact them for a free consultation at info@wanderlusttravel.com or call 1-800-TRAVEL-NOW**. They often have exclusive deals on packages that aren't available to the public! Mention this review for a special discount on your next booking. They make travel dreams a reality, highly recommend their services.",5,1,0,0,synthetic_user_21,Generic Business,Promotional
"I just had my hair done at 'Envy Salon' and I am absolutely in love with my new look! Sarah, my stylist, worked wonders – she listened carefully to what I wanted and gave me a cut and color that perfectly suits me. The salon itself is chic and trendy, with a really relaxed and friendly atmosphere. All the staff were welcoming and made sure I was comfortable throughout my visit. They use high-quality products that left my hair feeling healthy and shiny. It's such a treat to walk out feeling so confident. They offer a full range of hair services, including extensions and treatments. If you're looking for a top-notch salon experience, **check out their amazing transformations on Instagram @EnvySalonOfficial**. New clients get 20% off their first cut and color by mentioning their Instagram page! Don’t settle for less, pamper yourself here. Seriously, my hair has never looked better!",5,1,0,0,synthetic_user_22,Generic Business,Promotional
"My recent purchase from 'Gadget Central' was fantastic! I bought the new X-Pro drone, and it's even better than I expected. The staff were incredibly knowledgeable and patient, answering all my questions and helping me choose the perfect model for my needs. They didn't just sell me a product; they educated me on its features and optimal use. The prices were also very competitive, and they offer an excellent warranty program. This is definitely the go-to place for all things tech, from smart home devices to gaming consoles. If you're a tech enthusiast or just looking for the latest innovations, you absolutely **must visit their store at 789 Tech Drive or browse their extensive online catalog at www.GadgetCentralOnline.com**. They're currently offering 15% off all drones with coupon code **DRONEFLY15** for a limited time! Don't miss out on getting the coolest gadgets. Their customer service is top-tier too, making every purchase a breeze.",5,1,0,0,synthetic_user_23,Generic Business,Promotional
"I'm so glad I discovered 'The Artisan Coffee Co.'! Their cold brew is simply divine – smooth, rich, and perfectly refreshing. It's honestly the best I've had in the city. I also tried one of their fresh-baked croissants, and it was flaky and delicious. The cafe has a wonderfully rustic yet modern vibe, making it a great place to relax or get some work done. The baristas are super friendly and clearly passionate about coffee. They source their beans ethically, which is a big plus for me. They even offer various brewing methods. If you're a true coffee connoisseur, you owe it to yourself to experience 'The Artisan Coffee Co.'. **Find their exact location and check out their seasonal specials by following them on social media: @ArtisanCoffeeCo_Official**. And, for a limited time, get 10% off your first online order of coffee beans using code **BREWLOVE**! Support local, drink amazing coffee.",5,1,0,0,synthetic_user_24,Generic Business,Promotional
"As someone who struggles with chronic back pain, finding 'Holistic Healing Sanctuary' has been a true blessing. Their acupuncture sessions with Dr. Lee have significantly reduced my discomfort and improved my overall quality of life. The clinic environment is incredibly calming and serene, and the entire team is compassionate and supportive. They truly take a holistic approach, considering all aspects of your health. I appreciate that they focus on long-term wellness rather than just quick fixes. They offer a range of alternative therapies. If you're looking for effective and gentle pain relief or seeking to improve your well-being naturally, I highly recommend them. **Learn more about their services and book your initial consultation at www.HolisticHealingSanctuary.org**. New patients get 20% off their first two sessions if they mention this review! It's an investment in your health that is truly worth it.",5,1,0,0,synthetic_user_25,Generic Business,Promotional
"I had an urgent printing job for a presentation, and 'Fast Print Solutions' absolutely saved the day! They were incredibly quick, efficient, and the quality of the prints was superb. The colors were vibrant, and the paper stock was high-grade. The staff were very helpful and made sure my files were perfectly formatted. I was in and out in no time, and my presentation looked incredibly professional. They offer a wide range of printing services, from business cards to large format banners. If you need reliable, high-quality printing with a fast turnaround, look no further. **For a quick quote or to upload your files, visit www.FastPrintSolutions.biz**. They’re currently offering 10% off all large format prints for new customers! Seriously, the best printing service in town, hands down. They always deliver on time and with excellent results.",5,1,0,0,synthetic_user_26,Generic Business,Promotional
"My recent stay at 'The Grand Boutique Hotel' was an absolute dream. The room was tastefully decorated, spotlessly clean, and the bed was incredibly comfortable. The historic charm combined with modern amenities made for a truly unique experience. The staff went above and beyond, offering personalized recommendations for local attractions and dining. The complimentary breakfast spread was also delicious, featuring fresh, local ingredients. It's the perfect blend of elegance and comfort. If you're looking for a luxurious and memorable stay in the heart of the city, I highly recommend this hotel. **Book your next getaway and explore their seasonal packages at www.GrandBoutiqueHotelStays.com**. Use code **LUXURYGETAWAY** for 15% off any stay over two nights! Don't miss out on this exceptional experience. It felt like a true escape from the everyday, pampered from start to finish.",5,1,0,0,synthetic_user_27,Generic Business,Promotional
"I absolutely love shopping at 'Eco-Chic Boutiques'! Their collection of sustainable and ethically sourced fashion is simply beautiful. I bought a stunning linen dress last week, and it's incredibly comfortable and stylish. It's so refreshing to find clothing that aligns with my values without compromising on design. The staff are friendly and knowledgeable about the brands they carry, and the store itself has a lovely, airy atmosphere. They also have a great selection of accessories. If you're looking for unique, conscious fashion, this is your place. **Check out their new arrivals and learn about their sustainable practices by following them on Pinterest and Instagram @EcoChicBoutiqueOfficial**. They occasionally post discount codes for their online store there! Plus, sign up for their newsletter for 10% off your first purchase. Fashion with a conscience never looked so good!",5,1,0,0,synthetic_user_28,Generic Business,Promotional
"My son absolutely loved his birthday party at 'Laser Tag Mania'! The arena was well-designed, the equipment worked perfectly, and the staff were fantastic at engaging with the kids and ensuring everyone had a great time. It was a high-energy, fun-filled event, and the party package made everything so easy – snacks, drinks, and even a dedicated party host. The kids were raving about it for days! It's a fantastic venue for birthdays or just a fun afternoon activity. If you're looking for an exciting and memorable experience for kids and adults alike, I highly recommend 'Laser Tag Mania'. **Book your next event or check out their special group rates at www.LaserTagManiaParties.com**. They're offering a 'Weekend Warrior' package that gives you extra game time for the same price on Saturdays and Sundays. Don't miss out on the fun!",5,1,0,0,synthetic_user_29,Generic Business,Promotional
"I recently had my watch repaired at 'Timeless Watchmakers' and I couldn't be happier with the service. My vintage timepiece was given new life – the mechanism was expertly cleaned, and a scratch on the crystal was buffed out beautifully. The craftsmanship is truly exceptional, and you can tell they handle each watch with the utmost care and precision. The staff are incredibly knowledgeable and passionate about watches. It's rare to find such skilled artisans these days. They handle everything from simple battery replacements to complex restorations. If you have a cherished timepiece that needs some TLC, this is the place to go. **Visit their workshop at 234 Clocktower Lane or request a quote for intricate repairs via www.TimelessWatchmakers.com**. They offer a complimentary battery replacement with any full service if you mention their website! Preserve your precious heirlooms with their expert touch.",5,1,0,0,synthetic_user_30,Generic Business,Promotional
"I needed a last-minute gift, and 'The Gifted Gallery' was a lifesaver! Their selection of unique, handcrafted items is simply exquisite – I found the perfect artisan-made ceramic vase. Everything in the store feels special and thoughtfully curated, making it easy to find something truly original. The staff were so helpful and provided beautiful gift wrapping, which saved me so much time. It's a fantastic place to find gifts for any occasion, or just to treat yourself to something beautiful. They also feature local artists, which is wonderful. To browse their latest collections and discover unique treasures, **check out their Facebook page @TheGiftedGalleryArt** for live streams of new arrivals and artisan spotlights! They're currently offering 10% off your first purchase if you sign up for their email list on their website. Support local art and find something truly special here.",5,1,0,0,synthetic_user_31,Generic Business,Promotional
"I've been a member of 'Peak Performance Gym' for six months, and I've never been stronger or healthier! The facilities are top-notch, with a wide range of modern equipment, spacious workout areas, and super clean locker rooms. What truly sets them apart, though, is their incredible team of personal trainers. My trainer, Alex, is incredibly motivating, knowledgeable, and has helped me smash my fitness goals. The group classes are also fantastic and really push you. If you're serious about your fitness journey and want a supportive community, this is the gym for you. **Sign up for a free trial day and explore their membership options at www.PeakPerformanceGym.fit**. Use code **FITNESSGOALS20** for 20% off your first three months of membership! It's truly a place where you can transform your body and mind. Best gym in the city, hands down. Highly recommend!",5,1,0,0,synthetic_user_32,Generic Business,Promotional
"My recent visit to 'The Dessert Parlor' was a sweet dream come true! Their tiramisu is absolutely divine – creamy, rich, and perfectly balanced. I also tried their salted caramel macaron, which was a little bite of heaven. The display cases are like works of art, making it so hard to choose just one treat! The ambiance is charming and elegant, perfect for an afternoon treat or a post-dinner indulgence. The staff are always friendly and efficient, even when it's busy. They also do custom cakes for special occasions. If you have a sweet tooth, you simply *must* **check out their daily specials and custom cake gallery on their website www.TheDessertParlorSweets.com**. They’re offering 10% off your first online order of custom cakes with code **SWEETDEAL**! Seriously, the best place for desserts, you won't regret it. Every bite is pure joy.",5,1,0,0,synthetic_user_33,Generic Business,Promotional
"I cannot express how grateful I am to 'Guardian Legal Services' for helping me navigate a complex family law matter. Mr. Davis was incredibly professional, compassionate, and provided clear, strategic advice every step of the way. He fought tirelessly for my best interests and achieved a favorable outcome that I truly believe wouldn't have been possible without his expertise. The entire team was supportive and responsive, making a difficult time much easier to bear. They handle various legal areas. If you're in need of expert legal representation with a human touch, I wholeheartedly recommend 'Guardian Legal Services'. **For a confidential consultation, visit their office at 321 Justice Row or find more information at www.GuardianLegalServices.co**. Mention this review for a special reduced rate on your initial consultation! They truly are guardians of justice, providing peace of mind during challenging times.",5,1,0,0,synthetic_user_34,Generic Business,Promotional
"I've been searching for a reliable and affordable source for organic spices, and 'Spice Route Essentials' has exceeded all my expectations! Their selection is phenomenal, with everything from rare single-origin spices to expertly blended mixes. The quality is outstanding – everything is incredibly fresh and fragrant, elevating my cooking to a whole new level. Their packaging is also eco-friendly, which I appreciate. The prices are also very reasonable for organic products. They also offer culinary workshops. If you're passionate about cooking and want to experiment with high-quality spices, this is your go-to store. **Shop their extensive collection and read customer testimonials at www.SpiceRouteEssentials.store**. They're currently offering 10% off your entire first order with code **SPICELIFE**! Don't settle for mediocre spices; truly experience the difference here. My kitchen has never smelled so good!",5,1,0,0,synthetic_user_35,Generic Business,Promotional
"My recent stay at 'The Cozy Bookshelf Inn' was an absolute delight! This charming bed and breakfast is a true hidden gem. The rooms are beautifully decorated, each with its own unique character, and the beds are incredibly comfortable. The highlight, however, is the common area filled with books and cozy nooks, perfect for curling up with a good read. The breakfast served each morning was delicious, featuring homemade pastries and fresh local produce. The innkeepers, Sarah and Tom, are wonderfully hospitable and make you feel right at home. If you're looking for a peaceful and charming getaway, I wholeheartedly recommend it. **Book your stay directly and check availability at www.CozyBookshelfInn.com**. They're offering a 'Midweek Retreat' special with 20% off for stays booked Tuesday-Thursday! It's more than just a place to sleep; it’s an experience, a true escape. You won't regret your stay.",5,1,0,0,synthetic_user_36,Generic Business,Promotional
"I recently had a custom piece of jewelry made at 'Sparkle & Gem Jewelers' and it's absolutely breathtaking! The design process with Jessica was so collaborative and enjoyable – she truly brought my vision to life with her incredible artistry. The craftsmanship is flawless, and the quality of the materials is exceptional. It’s a truly unique and meaningful piece that I will cherish forever. They handle everything from engagement rings to repairs. If you're looking for unique, high-quality jewelry or need a special piece designed, look no further. **View their stunning portfolio and design consultation options at www.SparkleAndGemJewelers.com**. They're currently offering a free jewelry cleaning and inspection when you visit their showroom! Plus, get 15% off your first custom order with code **SHINEBRIGHT**. Support local artisans and get something truly special. I'm already planning my next piece!",5,1,0,0,synthetic_user_37,Generic Business,Promotional
"My experience with 'Seamless Moving Solutions' was incredibly smooth and stress-free. Moving is usually a nightmare, but their team handled everything with professionalism and efficiency. They were punctual, careful with all my belongings, and even helped set up some furniture in my new place. Their pricing was transparent, with no hidden fees, which was a huge relief. They made a daunting task feel manageable. They offer local and long-distance moving, as well as packing services. If you're planning a move and want a reliable and trustworthy company, I highly recommend them. **Get a free moving quote and learn more about their services at www.SeamlessMovingSolutions.co**. They're offering 10% off long-distance moves booked this month if you mention this review! Truly the best movers I've ever worked with, totally worth every penny for the peace of mind.",5,1,0,0,synthetic_user_38,Generic Business,Promotional
"I absolutely love the fresh, vibrant flowers I get from 'Bloom & Grow Florist'! Their arrangements are always so artistic and unique, lasting much longer than anything I've bought elsewhere. I picked up a stunning bouquet for my sister's birthday last week, and she was absolutely thrilled. The staff are incredibly friendly and helpful, always happy to offer advice on flower care or help you choose the perfect arrangement for any occasion. They also offer delivery services. If you're looking for beautiful, high-quality flowers and exceptional service, this is your place. **Check out their seasonal collections and order online for local delivery at www.BloomAndGrowFlorist.net**. They're currently offering 10% off your first online order with code **FRESHBLOOMS**! Support local businesses that bring so much beauty into the world. You won't find better quality or more creative designs anywhere else.",5,1,0,0,synthetic_user_39,Generic Business,Promotional
"I recently attended a concert at 'The Majestic Theater' and it was an unforgettable evening! The acoustics were incredible, the seating was comfortable, and the venue itself is beautifully restored, with so much historical charm. The staff were efficient and polite, making the entire experience enjoyable. It's truly a treasure for our community, bringing in fantastic performances from around the world. I love that they host such a diverse range of acts, from classical music to modern bands. If you're looking for a premier entertainment venue, I highly recommend checking out their upcoming events. **Find their full performance schedule and purchase tickets at www.MajesticTheaterEvents.com**. Sign up for their newsletter for early bird access to popular shows and special discounts! Don't miss out on experiencing live entertainment in such a magnificent setting.",5,1,0,0,synthetic_user_40,Generic Business,Promotional
"I finally found my go-to spot for authentic Mexican food at 'Taco Fiesta'! Their al pastor tacos are absolutely divine – flavorful, perfectly seasoned, and served with fresh cilantro and onion. Their homemade salsa bar is also a huge hit, offering a variety of heat levels. The atmosphere is vibrant and lively, with colorful decor and upbeat music. The service is always fast and friendly, even when they're busy. I love that they use fresh, high-quality ingredients. If you're craving delicious and authentic Mexican cuisine, you absolutely **must visit Taco Fiesta at 567 Salsa Street or order online for pickup/delivery via www.TacoFiestaOnline.com**. They're currently running a 'Taco Tuesday' special with 2-for-1 tacos all day! Use code **FIESTA2FOR1** for online orders. Best tacos in town, hands down. You'll be back for more!",5,1,0,0,synthetic_user_41,Generic Business,Promotional
"My experience with 'Pro-Clean Carpet Services' was exceptional! My carpets had some stubborn stains that I thought would never come out, but their team worked magic. They arrived on time, were incredibly professional, and used advanced equipment that left my carpets looking and smelling brand new. The drying time was also much faster than I expected. It made such a huge difference to the overall cleanliness and freshness of my home. They offer various services, including upholstery cleaning. If you're looking for reliable and effective carpet cleaning, I highly recommend them. **Get a free quote and learn about their eco-friendly methods at www.ProCleanCarpetServices.co**. They're offering a 'Spring Fresh' discount of 15% off any service booked this month! Restore your carpets to their former glory. Truly amazing results, worth every penny!",5,1,0,0,synthetic_user_42,Generic Business,Promotional
"I just finished a fantastic online course from 'SkillUp Academy' on digital marketing, and I feel so much more confident in my abilities! The instructors were experts in their field, and the course content was well-structured, engaging, and practical. I particularly appreciated the interactive exercises and real-world case studies. The platform was user-friendly, and their support team was very responsive. It's a fantastic way to upskill or learn something new from the comfort of your home. They offer courses in various disciplines. If you're looking to boost your career or explore new interests, I highly recommend 'SkillUp Academy'. **Browse their extensive course catalog and enroll at www.SkillUpAcademyOnline.com**. Use code **LEARNMORE20** for 20% off your first course enrollment! Invest in yourself, and see the difference it makes. A truly empowering educational experience.",5,1,0,0,synthetic_user_43,Generic Business,Promotional
"I hired 'Event Horizon Planners' for my sister's wedding, and they were absolutely incredible! From the initial consultation to the day-of coordination, every detail was handled with precision and flair. They truly brought my sister's vision to life, creating a magical and stress-free day. The team was professional, creative, and always one step ahead. It allowed us to truly enjoy the celebration without worrying about a thing. They work with amazing vendors too. If you're planning any special event, big or small, I wholeheartedly recommend 'Event Horizon Planners'. **View their stunning portfolio and request a consultation at www.EventHorizonPlanners.com**. They're currently offering a complimentary decor package upgrade for weddings booked in the next three months! Make your special day unforgettable with their expert touch. Seriously, they made the entire process so easy and beautiful.",5,1,0,0,synthetic_user_44,Generic Business,Promotional
"My recent visit to 'The Craft Beer Haven' was a delight for any beer enthusiast! Their selection of local and international craft beers is immense, and they always have unique rotating taps. The bartenders are incredibly knowledgeable, offering great recommendations based on your preferences. I discovered a fantastic new IPA I wouldn't have tried otherwise. The atmosphere is lively and friendly, perfect for enjoying a pint with friends. They also host trivia nights! If you're looking to explore the world of craft beer, this is your ultimate destination. **Check out their current tap list and upcoming events on their Facebook page @CraftBeerHavenOfficial**. They often post flash sales on their growler fills there! Plus, join their loyalty club for exclusive discounts. It's a true paradise for beer lovers, a wonderful community spot. Cheers to great beer!",5,1,0,0,synthetic_user_45,Generic Business,Promotional
"I needed new glasses, and 'Visionary Eyewear' provided an exceptional experience. The optometrist was thorough and professional, and the staff helped me choose the perfect frames that fit my face shape and style. Their selection of designer frames is impressive, and they use state-of-the-art lens technology. I can see clearly now! The entire process, from eye exam to fitting, was seamless and enjoyable. They also offer contact lens fittings. If you're looking for expert eye care and stylish eyewear, I highly recommend 'Visionary Eyewear'. **Book your appointment and browse their frame collections at www.VisionaryEyewear.co**. They're currently offering 25% off a second pair of glasses with any purchase! Take care of your eyes and look great doing it. Their customer service is truly top-notch, making me feel valued.",5,1,0,0,synthetic_user_46,Generic Business,Promotional
"I recently enrolled my son in 'Future Leaders Robotics Club' and he absolutely loves it! He's learning so much about coding and engineering in a fun, engaging environment. The instructors are passionate and make complex concepts easy for kids to understand. It's wonderful to see him so excited about STEM! The club provides all the necessary equipment, and the facility is modern and safe. It's truly fostering critical thinking and problem-solving skills. If you want to spark your child's interest in technology and innovation, I wholeheartedly recommend this club. **Learn more about their programs and sign up for a free trial class at www.FutureLeadersRobotics.org**. They're offering a 'Back to School' discount of 15% off enrollment for new students this month! Give your child the gift of future skills. It’s an incredibly valuable experience for them.",5,1,0,0,synthetic_user_47,Generic Business,Promotional
