description,rating,ispromotional,isirrelevant,notvisited,author,company_name,policy_type
Hands down one of the best Mexican restaurants in SG. Quite amazing tacos.,5,0,0,0,Roshini Ravindran,scarps,Clean
I ordered original dumplings and mushroom noodles. Used Burpple Beyond and I’d say the noodles are surprisingly good and it’s worth trying! Ramen egg is good too.,5,0,0,0,Dorothy Tan,DD,Clean
"Love the Mexican food here. We have revisited 3 times and my favs are the baja fish & chicken quesadilla. Staff are very attentive & efficient. Very popular with long queues whenever I visit on Sat for dinner, so come earlier if you can!",5,0,0,0,JM,google_reviews,Clean
"{'en': ""Rule number 1, don't come during peak hours then complain about waiting time. Rule number 2, there's unlabeled reaper sauce, try at your own risk. Rule number 3, when they say the nachos is loaded, it is very very loaded.""}",5,0,0,0,cjhj,google_reviews,Clean
"Amazing dessert spot, once we saw the line we knew it was legit. CASH only. The staff will let you browse and order, followed by 30 mins to consume your dishes. Absolutely understandable, lots of hungry dessert seekers waiting! Ordered the durian mango sago with pomelo, gluttonous black rice with ice cream, and mochi. Many items were sold out, which makes me want to try them even more (particularly the HK style dishes). Can’t wait for next time!",5,0,0,0,Jason W,ahchews,Clean
Really good and affordable Mexican food! Had it a couple of times when they were located at Cross Street but they’ve an expanded menu and revamped recipes which taste even better now. Loved the burrito bowl - super flavourful and packed with loads of ingredients. Cauli-bites and Baja Tacos are our usual go-to. Service folks were really nice and friendly too!,5,0,0,0,Jessica Yeo,google_reviews,Clean
Lovely and cozy place to get some awesome food. They had a good variety of unique dumplings and we ate every single one brought out in no time flat. Relatively affordable for Singapore but surely not the cheapest dumplings. They had a couple good beers on tap and overall loved my small dinner had here.,5,0,0,0,John Dillon,DD,Clean
"This cute place was a random choice one night and it was really a great experience! We had to wait for a while, like 20 mins to get a table because it was very packed and we didn’t have a reservation but in the end we got the table and service was very nice! Staff is nice and attentive, food is delicious! We tried noodles which were very good and then I had vegetarian gyozas (there are two types), one of the two after a few gyozas is a bit nauseating as it has cinnamon in it but the taste is very nice and peculiar! You can tell that the gyoza dough is made fresh by them! They have also nice cocktails (very pricey, 20 dollars) and very delicious artigianal beers (for 8 dollars), very recommended!",5,0,0,0,Mariateresa Signorile,DD,Clean
"Fun food, Great service! (though waiting time can be improved.. esp if reserved tables are late) Try them all!",5,0,0,0,Cherlyn N,DD,Clean
"[Oct 2023] First time here but definitely not the last. Most of the dishes are unique to the cafe and well-thought - all the components on the plate complement each other perfectly. Special mention - The pistachio raspberry cube was splendid - flaky buttery pastry with rich pistachio cream. Service was fast and friendly, it was full house even at 3pm on a Saturday. Cafe doesn’t take reservations. (Updated photos from visit in Nov 2023)",5,0,0,0,Orrdii Tan,dough,Clean
"Go here. You won’t be disappointed. Small and cosy with friendly service. Casual atmosphere with really tasty food. Perfect for satisfying that Mexican craving. Loaded nachos, mushroom quesadilla and fish tacos were my top pics.",5,0,0,0,Paul Brindley,scarps,Clean
Really enjoyed brunch here. Everything was reasonably priced and the flavours were not what we were expecting of each item. Definitely elevated brunch,5,0,0,0,JM,dough,Clean
"Ordered the dumplings platter for delivery: love the potato and cheeziness of the Fried Pierogi, the original and smoked duck are amazing too. Worth a try! The noodles are a very yummy fusiony accompaniment too.",5,0,0,0,Colin Tan,DD,Clean
Great food and ambience. Dumplings and noodles were simply scrumptious. The cold beer was fruity amd delicious. Definitely worth a visit. Price is reasonable too.,5,0,0,0,S F,DD,Clean
"Great casual Mexican restaurant. Tacos are flavorful and tasty, good variety of starters to select from. Margaritas are great as well. Expect some queue and waiting time during peak hours. Would just wish that the New Bahru outlet also had the chicken tacos..",5,0,0,0,Maximilian,scarps,Clean
"{'en': ""Never dissapoints - the miso mushroom noodles are just super amazing along with veggie mandu. Go for the bento box if in stock! Salted Plum goji drink is great but can be shared by two. Taste is little overpowering but loved it. Didn't like longan drink.""}",5,0,0,0,S C,DD,Clean
"{'en': ""This has got to be the best Mexican food I've eaten till date! Awesome tacos and quesadillas. Best favourite is the fried fish! Highly highly recommended! Place is small so seats are quite limited.""}",5,0,0,0,Jacky Wu,google_reviews,Clean
Geez the staff is quite unfriendly but god damn the food is good. But acutally the staff is not that bad... we said we only had 3 poeple but we had someone else join us after and he still let the person come in so at the end of the day i think he is a nice guy. He also tell us that the chilli was spicy and gees it was fricking fricking spicy so that was that thanks brother The queue is insane but the food is insane as well so i think it is warranted.... book early so you dont have to queue and make sure you arrive on time cos they give your seat away after 15 mins,5,0,0,0,jordan chong,scarps,Clean
One of the best desserts place in Singapore. Walking distance from Bugis Junction.,5,0,0,0,Rocky Saputra,ahchews,Clean
"{'en': ""This dessert shop is a hidden gem! I came here on a whim and was blown away by the quality of their sweets. The standout for me was definitely the ice cream with black glutinous rice ，it’s a perfect balance of creamy and chewy, with just the right amount of sweetness. The texture of the black rice complements the smooth ice cream so well, it’s both comforting and refreshing. Highly recommend this place to anyone with a sweet tooth， you won't be disappointed!""}",5,0,0,0,Hope,ahchews,Clean
"The portions were decent. most things on the menu are delicious, but fish tacos were a let down, and tasted similar to filet o fish from mcdonalds.",5,0,0,0,mame goma,google_reviews,Clean
"Usually i will takeaway, but this time round i decided to eat in. Got my seats 10-15mins, and queue to order take about 5-10mins. Very fast even though queue was long. I ordered honeydew sago, mango pomelo, old school dessert",5,0,0,0,LiJie Ang,ahchews,Clean
Have to do booking else will be a long Q. No reservations in Friday night.,5,0,0,0,Keiko Shan,google_reviews,Clean
Coconut ice cream on black glutinous porridge and mango pomelo,5,0,0,0,C,ahchews,Clean
"Nice authentic Mexican 🇲🇽 food you can get . Great atmosphere, plenty of place to accommodate many guests at level one & level two. Smiling staff with good service & plenty of dishes to choose from . Great place to dine in with family & or friends . …",5,0,0,0,Himanshu Gupta,scarps,Clean
"Came here for dinner on a wed night and arrived about 7pm and theres was already a queue formed up, not a long one yet. Waited about 15mins to get in and we ordered the tacos, quesadillas and nachos and everything was amazing and so worth it for its price! The beef birria quesadillas tasted so good with a mixtures of spices and herbs thats makes it so flavourful, along with the birria sauce. Got the fish taco and the fish was so fresh, however the jam on it wasn’t for me personally but you can still try it! The mega loaded nachos was the most worth it dish to get tho! Such a huge portion and they were so generous with the fillings! Looking forward to my next visit",5,0,0,0,Elvis Tan,google_reviews,Clean
"Ramen was amazing with different sides to choose from!!!!! Came here a few times already, highly recommend the sichuan pork noodles and fried pierogi",5,0,0,0,Phang Kuang Wei,DD,Clean
Our go to mexican food. Food has been consistent in terms of flavors and portions. Keep up the good work. Only thing is the Q which is understandable given the popularity.,5,0,0,0,Kerry Wong,google_reviews,Clean
"Luckily came with a big group so we could try loads of things: birria quesadilla/ taco, al pastor quesadilla/ taco, baja taco and gambas taco, corn cob and loaded nachos. Best things were corn cob (was really better than expected, slightly charred, spiced up and cheese) and the birria taco! Will dream of this until the next time I get to eat it. Come early because the queue gets really long. They are really strict with the dining hours because of the queue.",5,0,0,0,Natasha Tjahjadi,scarps,Clean
"{'en': ""14 Jun update: still as popular with snaking queue. Good thing the queue move fasts so still worth the short wait. Everything is yummy. Tables are meant to be small so you don't get cosy up and stay too long. But that's fine. One of the most popular dessert place in Singapore selling chinese desserts. I still feel HK dessert taste much better. When you have the cravings, Ah Chew is best in SG to fill in. Favoured by locals and tourists. Orderly queue line. Even though it can go snakey long, the queue moves fast. They restrict eating time to 30 mins and the staff will come to chase you when time is due.""}",5,0,0,0,Eve C,ahchews,Clean
amazing food. pretty staff. 👍🏻👍🏻 edited: came here again. food still slaps. Quality is consistent. Customer service is great. Staff are friendly and attentive. Pretty staff is still there.,5,0,0,0,Chandler Lim,scarps,Clean
"nice desserts! their mochi was so good, very chewy- a must order ✅ their desserts wasn’t very sweet too",5,0,0,0,Janice E (彭林寶),ahchews,Clean
"Came here for dinner without reservation on a Saturday evening. The waiting time was reasonable though the place is a little small. Really amazing food, we ordered the noodles and a dumpling platter. If you’re unsure of what to try first, get the platter as you get to try the different dumplings without too much of a commitment. Overall really delicious, staff seemed to really enjoy working there as well, so we really liked the vibes too. Pardon the lighting, doesn’t do the food justice :)",5,0,0,0,Jerin Lee,DD,Clean
"food was actly bussin so i und the hype. loaded nachos was yums, fish tacos had a tangy fun mango sauce, the steak quesadillas were p impressive and the steak filling was rly good. queued ard 45 mins on a thursday evening.",5,0,0,0,Amanda K,scarps,Clean
"This is my second time back and it is definitely still up to standards. I came back because my friend and I were craving their loaded nachos and it didn’t disappoint. All their other dishes are really good too, super flavourful and filling. The only thing is that the place gets quite crowded and cleanliness couldn’t be kept up to standard therefore it felt slightly uncomfortable. But nothing too much of a bother and I absolutely love their food so I’ll definitely be back again.",5,0,0,0,Xian Xuan,scarps,Clean
Wide variety of dumplings and the noodles taste great. Service there is top notch too! Expect to queue if you don’t make a reservation.,5,0,0,0,SzeLing Tay,DD,Clean
"amazinnnggg food is definitely an understatement. the noodles and dumplings are cooked to perfection. so savoury! 🥟 they had a great lunch set at $17, and it was super worth it. i got the xo prawn noodles with the original dumplings. just wish the prawns came peeled, it was quite troublesome to peel with chopsticks and a ceramic spoon. the ambience is really nice, dim and cozy. can get a little loud when there are a lot of people in the compact space. overall, highly recommended if you’re in the area!",5,0,0,0,Kim Ricafort,DD,Clean
"This is my second time back and it is definitely still up to standards. I came back because my friend and I were craving their loaded nachos and it didn’t disappoint. All their other dishes are really good too, super flavourful and filling. The only thing is that the place gets quite crowded and cleanliness couldn’t be kept up to standard therefore it felt slightly uncomfortable. But nothing too much of a bother and I absolutely love their food so I’ll definitely be back again.",5,0,0,0,Xian Xuan,google_reviews,Clean
Delicious dumplings (please order the dessert!) and great non-alcoholic drinks! Place is quite cramped but service was prompt and attentive.,5,0,0,0,K W,DD,Clean
It was my first time at this outlet and I enjoyed the dumplings very much. They were as delicious as the ones from the circular branch. The service was speedy and friendly too.,5,0,0,0,nina e,DD,Clean
"The atmosphere at this outlet is different than the one at Circular Road. It feels like a hidden restaurant tuck away with delivery food. The staff were nice and helpful. I was waiting for my friend, so I asked if I could be seated and order first, and they showed me to a table. The dumplings and Miso Mushroom Noodles were really flavourful.",5,0,0,0,Yukino Angela,DD,Clean
"Great place for delicious Mexican food. However, you need to be patient… just have to queue on weekend because can’t make reservation.",5,0,0,0,Nick Lim,google_reviews,Clean
"The food was really good, we got their loaded nachos and tacos. Even though we had a reservation, they were really packed and the staff was really busy so we had to wait quite a while. They also accidentally gave another table our tacos and we had to wait for an additional 20 mins after finishing the nachos. Would definitely recommend making a reservation before going though, I went on a Monday afternoon and it was packed. I would highly recommend going for the food though, it was amazing!!",5,0,0,0,Ang Wei Lin,scarps,Clean
"{'en': ""At night looking for dessert, you can try coming here. Various hot and cold desserts are available. it's just that you have to be prepared to queue, especially on weekends. the price for 2 courses is around S$10, I tried mango pomelo and black bean. Mango pomelo must be tried, it's really delicious""}",5,0,0,0,Putri Utami Ruswandi,ahchews,Clean
"Probably one of the best Mexican food places in SG. Loved the loaded nachos that came witih chicken, loads of guacamole, cheese Will go back for more",5,0,0,0,Unconventional Passionss,google_reviews,Clean
Traditional desserts place which is our go to after dinner at bugis. Love the ah balling and you can also order a half half of almond and black sesame paste.,5,0,0,0,Vincent F.,ahchews,Clean
"{'en': ""Best Mexican I've had in Singapore (but the bar is low). Expect a wait if you go during peak hours but they seemed to turn over tables relatively quickly. Food is not too expensive and portion sizes are big. The pork Al pastor burrito is the best. Loaded nachos also good, and had flavorful guacamole. Fish tacos are fried nicely. The churros are BOMB and not too sweet""}",5,0,0,0,Yuchen L,scarps,Clean
"I have only been here twice but it is my favourite brunch place ever! Food is far superior to many other supposedly nice cafes (cough PS cafe). Also, this is only cafe i have ever been to where the food in real life looks way better than the pictures lol Wait staff are also very attentive and nice - one of them saw me blowing my nose and offered me hot water which was effective af. Ambience is great too and nestled at a corner in Chijmes. 10/10 would recommend",5,0,0,0,Alyssa Low,dough,Clean
"Having lived in San Diego for a few years, I feel pretty confident when it comes to reviewing Mexican food and Huevos does a great job. We ordered the chicken chipotle quesadilla, fish tacos, and elotes. The quesadilla was excellent: packed with chicken and cheese, definitely not thin or skimpy, and nicely garnished. The fish tacos were also solid, although the toppings were a little overpowering if you ate it blindfolded, you might not immediately guess it was fish. Still, it was a great taco overall. My only real complaint was the elotes. For the price, getting only one cob of corn felt a little disappointing. It was grilled rather than steamed or boiled, and compared to what I’m used to, it was pretty lightly seasoned. I usually expect elotes to be dripping in butter and spices this one felt a little bare, which was a letdown since elotes are one of my favorite Mexican foods. Overall, I can’t say anything bad about the place. I’d definitely recommend it to a friend, and it’s somewhere I’d feel confident taking a Mexican friend to as well. Bonus points for having Modelo, Jarritos, and Tapatío seeing a Modelo in Singapore almost made me do a backflip.",5,0,0,0,Kalib K,google_reviews,Clean
"Love the friendly staff at Huevos! My friends and I came here for the first time to celebrate my birthday, they even gave us free brownies ! Would definitely come back again and enjoy the food. Food wise, well seasoned, taste authentic and don’t forget to add their signature sauce ! Once again, thank you Huevos for the memories and good service :)",5,0,0,0,Adel11 01,google_reviews,Clean
"Be ready to queue for an hour or so. 😝 Do give their priciest pasta a try! Al granchio e limone ($26) topped with visible blue swimmer 🦀 meat and drenched with flavourful lemon sauce. The cacio de pepe was a bit of a miss for me, as the pasta was undercooked ~""too chewy"".😄 However, the crispy guanciale completely turned my day around!😋❤️ Be ready to queue for an hour or so. 😝 Do give their priciest pasta a try! Al granchio e limone ($26) topped with visible blue swimmer 🦀 meat and drenched with flavourful lemon sauce. The cacio de pepe was a bit of a miss for me, as the pasta was undercooked. However, the crispy guanciale completely turned my day around!😋 😍The open kitchen was a treat, as we enjoyed watching our pasta being expertly prepared to the tune of classic Italian music. Despite the bustling crowd, the ambience remained peaceful and relaxing. We finished off with a good portion of melt in the mouth Tiramisu 😋 Overall, it was a wonderful dining experience at the restaurant (minus the queue)! Loving the service...that was warm and attentive, striking the perfect balance between casual and professional. 🤩💕",5,0,0,0,C S,scarps,Clean
"🥟 The sharing set comes amazing dumplings with unique flavours (Duck, Mentaiko sauce, Curry powder, Mayo, Soy sauce). 🍝 The noodles are well done and seasoned well. The fried onions gives it a good crunch. The service was amazing. Props to the staff who accommodated us well even though we were walk ins during the busy evening dinner time. He was able to get us a table after telling us to wait for a while 😊",5,0,0,0,Jarome Ng,DD,Clean
"Ordered nachos, fish tacos and pulled pork quesadillas! The nachos with guacamole was ok. The cheese in the quesadillas was very nice and the fish tacos was very crispy. Do expect a long queue if you come late.",5,0,0,0,YQ Lau,scarps,Clean
Really good Mexican food. Service is great with very friendly staff. In particular enjoyed the calamari.,5,0,0,0,Ali Jumabhoy,scarps,Clean
"Liang Seah street is closed off on Saturday and Sunday evenings, turning the whole area into a bustling open-air dining experience. The vibe is lively yet relaxed….perfect for enjoying a bowl of their refreshing mango sago 🤤 or ah-ma’s black sesame paste 😋under the evening sky. The desserts taste better when paired with this outdoor energy! 🤓",5,0,0,0,Enrol Wehc,ahchews,Clean
SO FREAKING GOOD…. every bite was a flavour explosion oh my goodness. a bit on the pricey side but i can say it’s 100% worth!!! i literally dream of the fish tacos. you might want to go early bc queues form fast after they open!,5,0,0,0,jay k.,google_reviews,Clean
Friendly service and rich taste of dumpling! Can try many type of fried dumpling with a good drink. Dessert is a sweet secret 🤫 …,5,0,0,0,YU-FENG CHEN,DD,Clean
"The quesadillas and burritos are simply delicious. Had chicken and pork, both were great. Their homemade chili are amazing. Very hot, but definitely worth the challenge! The burrito is so huge, very well worth the money. Quesadilla is crispy and yummy. Super great service by the staff, friendly and thorough with their explanation of the different types of chili available.",5,0,0,0,XY,google_reviews,Clean
First time trying Ah Chew dessert at Liang Seah Street.. Order Yam Paste (hot) and Durain Mango Pomelo (cold) Yam paste was good.. Pomelo a bit bitter.. If pomelo is those sweet type will be best.. Anyway price ok and can go again!!,5,0,0,0,ah new,ahchews,Clean
"The original dumplings were the best, and the Soyou Mushroom Noodles were also good.",5,0,0,0,요쿠마,DD,Clean
"Repeated visits over the years! Their lunch deals are a bang for buck but dinner vibes are so on point too. The noodles never disappoint, generous portions and dumpling always fried/cooked to perfection. The pierogi dumplings is an easy favourite, with the sriracha crema dressing before the perfect cherry on top. Dont give their dessert dumplings a miss - the poached pears fried dumps reminds me of apple pie, and their vanilla ice cream is rich and aromatic, with visible vanilla pods. Reservations are recommended in advance, as they have limited seating",5,0,0,0,Wei Qian (Sandy),DD,Clean
"Went to both outlets and food is always on point! Repeated orders were their loaded nachos. The chicken used was so tender, not dry at all, guac was fresh, and it was a mountain enough for 2 pax! Queues are just really long so I hope for more outlets!!",5,0,0,0,Shan Khoo,scarps,Clean
"Visited twice in two weeks because I enjoyed the food and ambience so much. For two people, we ordered pickled bean sprouts, pickled black fungus, dumpling platter of 15, miso mushroom noodles, longan osmanthu pu-erh, and bottomless artisanal hot tea, all of which served promptly by the attentive staff, who also accommodated my seat-related request. Definitely recommend making a reservation, and noting the time limit of 1 hour for dinner.",5,0,0,0,W,DD,Clean
"Tacos were really loaded, fresh and flavourful. Servings were all generous. A definite recommend!!",5,0,0,0,Jesslyne Lee,google_reviews,Clean
One of the best Mexican places in Singapore. Generous portions and good value for money. Recommend the Baja Nuggies and Baja Fish Tacos!,5,0,0,0,Yihui,google_reviews,Clean
"This Mexican food is highly recommended. We ordered Overload Nachos, Tacos - beef and fish, pino colada, margarita. The portion is generous and quality. Overall the food and cocktail is excellent. The meal is so satisfying and will definitely return again. It’s best to plan your reservation in advance, otherwise be ready to queue at least 20-40min during peak hour.",5,0,0,0,R T,google_reviews,Clean
"The best Mexican restaurant I’ve ever been to so far. Every dishes here are amazing, tasty and fresh. My favorite is fish tacos which comes with hot and crispy baja piece, mixed well with the sauce. Quesadilla was filled with lots of mushroom and cheese. Not really interested in the loaded nachos but it came with a huge portion. Every dish was served hot. We have to get the horchata (strong sense of cinnamon) and agua fresca (so fresh with watermelon juice and mint leaves) every time. The staffs are super friendly and helpful. Would be long queue during peak hour but they will open second floor so the queue will move quite fast. The place might be a bit noisy sometimes due to the soundproofing. This is the place that I will remain coming back for sure. Affordable price with delicious food!!",5,0,0,0,Megan Ng,google_reviews,Clean
Great food here but the queue situation wasn’t handled very well. It’ll be good to give us online queue numbers. Waitress wasn’t very friendly.,5,0,0,0,Denise T,scarps,Clean
"{'en': ""The pierogi dumplings are my fav! The smoked duck dumplings are more ordinary. The iced passionfruit ginger soda adds a refreshing touch to the entire meal. Reservations are recommended as they're usually booked out.""}",5,0,0,0,Shandy L.,DD,Clean
"Food was amazing!! Highly recommend the Loaded Nachos, Chipotle Chicken Quesadilla and Baja Fish Tacos, especially the last one. The portion was huge and we ended up having to takeaway our leftovers. Price was super reasonable and the food was worth every penny. Service was great and staff was really helpful. The only thing is you have to make a reservation as the queue is quite long. Eating time is limited to one hour, but since the service is really fast, that’s okay too. This might be my new favourite restaurant!",5,0,0,0,enoch k,scarps,Clean
"{'en': ""Traditional dessert shop that brings back childhood memories. From peanut soup, to tarp, to black glutinous rice to mango sago, there are literally over 30 choices on their menus (yep, I didn't count). If you enjoy ice cream, highly recommend you add a scoop to the dessert. Makes it just that much sweeter.""}",5,0,0,0,Hoe Bing Lo,ahchews,Clean
"{'en': ""An awesome place to enjoy great Mexican food at a decent price. Can't really comment on authenticity, but you can't go wrong with layers of melted cheese, onions and guacamole blanketing crispy nacho chips. I recommend the quesidilla and loaded nachos. Only gripe is the suuuper long queue in the hot outdoors. I would say it's worth to try once, then decide if you ever want to queue again!""}",5,0,0,0,JK Chow (Jingzyy),google_reviews,Clean
"{'en': ""Tried their hot steamed milk w papaya n cold yam sago. Enjoyed it. Queue seems long but it's moving quite fast. Tried their Red bean soup w lily bulb too previously, love that. Sadly, it's sold out when I reached this time.""}",5,0,0,0,Celestine Kau,ahchews,Clean
